{
  "id": "story.custom-video",
  "kind": "section",
  "name": "Custom content video block",
  "purpose": "Sells the bespoke content studio with a headline, a watch CTA and a video thumbnail beside an explanatory paragraph.",
  "category": "story",
  "source": {
    "id": "CustomVideo.section[data-section=custom-video]",
    "tag": "section",
    "file": "src/components/sections/CustomVideo.jsx",
    "lines": "16-51"
  },
  "semantic": {
    "id": "story.custom-video",
    "category": "story"
  },
  "retrievalEligible": true,
  "designSystem": "marketing",
  "implementedBy": "src/components/sections/CustomVideo.jsx",
  "description": "Legacy green-theme hairline block (left and bottom borders only) in container-large: a header with a 64px serif H2 (max 42rem) and a green pill button, then a bordered 2-column grid of a 16:9 video lightbox thumbnail (right hairline) and a 20px paragraph. One column at <=767, with the paragraph moved above the thumbnail at <=479. Used once, on /content/custom-content.",
  "content": {
    "type": "object",
    "additionalProperties": false,
    "properties": {
      "heading": {
        "type": "string",
        "minLength": 1,
        "maxWords": 12,
        "measuredLongestRealInstance": "9 words in the clone's own placeholder copy"
      },
      "ctaLabel": {
        "type": "string",
        "minLength": 1,
        "maxWords": 5,
        "note": "Green pill button; the thumbnail links to the same target.",
        "measuredLongestRealInstance": "4 words in the clone's own placeholder copy"
      },
      "text": {
        "type": "string",
        "minLength": 1,
        "maxWords": 59,
        "measuredLongestRealInstance": "47 words in the clone's own placeholder copy"
      },
      "thumbnail": {
        "type": "object",
        "additionalProperties": false,
        "x-allowedRoles": [
          "product.video",
          "stock.photo",
          "placeholder.neutral",
          "screenshot.placeholder",
          "illustration.generated",
          "asset.userSupplied"
        ],
        "properties": {
          "assetRole": {
            "enum": [
              "product.video",
              "stock.photo",
              "placeholder.neutral",
              "screenshot.placeholder",
              "illustration.generated",
              "asset.userSupplied"
            ]
          },
          "placeholderLabel": {
            "type": "string",
            "minLength": 1,
            "maxWords": 6,
            "note": "Label drawn inside the neutral placeholder slot (Placeholder.jsx label prop)."
          },
          "alt": {
            "type": "string",
            "minLength": 1,
            "maxWords": 10
          },
          "assetRef": {
            "type": "string",
            "pattern": "^(generated/[a-z0-9][a-z0-9-]*\\.(webp|avif|png|jpg|svg|mp4)|stock/[0-9]+(-sq)?\\.jpg)$",
            "note": "ONLY for roles whose generationPolicy is may-generate-new (ASSET_REF_FORBIDDEN_FOR_PROTECTED_ROLE). Must point at a NEWLY generated file under generated/ -- never /assets/, public/assets/ or a URL. The 56 files in the source project's public/assets/ are the user's local reference copies of the original site's imagery and are never valid here."
          }
        },
        "required": [
          "assetRole"
        ]
      }
    },
    "required": [
      "heading",
      "ctaLabel",
      "text",
      "thumbnail"
    ]
  },
  "constraints": {
    "maxPerPage": 1,
    "maxPerPageDerivation": "derived: the most times this (section, variant) occurs on any real template (templates/templates.json)"
  },
  "motion": {
    "allowedPatterns": [
      "none"
    ],
    "reducedMotionFallback": "none",
    "measuredFrom": "src/components/sections/CustomVideo.jsx:28-28",
    "sourceImplementsReducedMotion": false,
    "reducedMotionNote": "The schema REQUIRES this fallback on every generated node. Neither the original site nor the clone implements prefers-reduced-motion; this is a generation-time requirement, not a description of the source.",
    "note": "No section motion; the pill button swaps colour instantly on hover (only border-radius carries a .3s transition, as on the original)."
  },
  "responsive": [
    {
      "breakpoint": "tab",
      "query": "max-width: 991px",
      "breakpoints": [
        "tab",
        "mob",
        "xs"
      ],
      "kinds": [
        "spacing"
      ],
      "changes": "px-[2.5rem] -> tab:px-[2rem] -> mob:px-[1.5rem] -> xs:px-[1rem]; pt-[5.5rem] -> tab:pt-[4rem]",
      "tailwind": [
        "tab:px-[2rem] tab:pt-[4rem] mob:px-[1.5rem] xs:px-[1rem]"
      ],
      "measuredFrom": "src/components/sections/CustomVideo.jsx:20-20",
      "derivation": "auto: breakpoint-prefixed classes on the cited line, paired with their unprefixed base"
    },
    {
      "breakpoint": "xs",
      "query": "max-width: 479px",
      "breakpoints": [
        "xs"
      ],
      "kinds": [
        "sizing",
        "layout",
        "spacing"
      ],
      "changes": "xs:w-full; xs:flex-col; xs:items-stretch; gap-[1.5rem] -> xs:gap-[1rem]",
      "tailwind": [
        "xs:w-full xs:flex-col xs:items-stretch xs:gap-[1rem]"
      ],
      "measuredFrom": "src/components/sections/CustomVideo.jsx:25-25",
      "derivation": "auto: breakpoint-prefixed classes on the cited line, paired with their unprefixed base"
    },
    {
      "breakpoint": "tab",
      "query": "max-width: 991px",
      "breakpoints": [
        "tab",
        "xs"
      ],
      "kinds": [
        "spacing",
        "typography",
        "layout"
      ],
      "changes": "px-[1.25rem] -> tab:px-[1rem]; py-[0.75rem] -> tab:py-[0.5rem]; text-[1.125rem] -> tab:text-[1rem]; xs:block; xs:self-stretch",
      "tailwind": [
        "tab:px-[1rem] tab:py-[0.5rem] tab:text-[1rem] xs:block xs:self-stretch"
      ],
      "measuredFrom": "src/components/sections/CustomVideo.jsx:28-28",
      "derivation": "auto: breakpoint-prefixed classes on the cited line, paired with their unprefixed base"
    },
    {
      "breakpoint": "mob",
      "query": "max-width: 767px",
      "breakpoints": [
        "mob"
      ],
      "kinds": [
        "layout",
        "spacing"
      ],
      "changes": "grid-cols-2 -> mob:grid-cols-1; gap-y-[4px] -> mob:gap-y-[1rem]",
      "tailwind": [
        "mob:grid-cols-1 mob:gap-y-[1rem]"
      ],
      "measuredFrom": "src/components/sections/CustomVideo.jsx:36-36",
      "derivation": "auto: breakpoint-prefixed classes on the cited line, paired with their unprefixed base"
    },
    {
      "breakpoint": "mob",
      "query": "max-width: 767px",
      "breakpoints": [
        "mob",
        "xs"
      ],
      "kinds": [
        "spacing",
        "layout"
      ],
      "changes": "py-[6rem] -> mob:py-[3rem]; xs:order-2; xs:p-[1.5rem]",
      "tailwind": [
        "mob:py-[3rem] xs:order-2 xs:p-[1.5rem]"
      ],
      "measuredFrom": "src/components/sections/CustomVideo.jsx:39-39",
      "derivation": "auto: breakpoint-prefixed classes on the cited line, paired with their unprefixed base"
    },
    {
      "breakpoint": "tab",
      "query": "max-width: 991px",
      "breakpoints": [
        "tab",
        "xs"
      ],
      "kinds": [
        "spacing",
        "layout"
      ],
      "changes": "tab:p-[1.5rem]; xs:order-1; px-[2.5rem] -> xs:px-[1rem]",
      "tailwind": [
        "tab:p-[1.5rem] xs:order-1 xs:px-[1rem]"
      ],
      "measuredFrom": "src/components/sections/CustomVideo.jsx:43-43",
      "derivation": "auto: breakpoint-prefixed classes on the cited line, paired with their unprefixed base"
    },
    {
      "breakpoint": "xs",
      "query": "max-width: 479px",
      "breakpoints": [
        "xs"
      ],
      "kinds": [
        "typography"
      ],
      "changes": "text-[1.25rem] -> xs:text-[1.125rem]",
      "tailwind": [
        "xs:text-[1.125rem]"
      ],
      "measuredFrom": "src/components/sections/CustomVideo.jsx:44-44",
      "derivation": "auto: breakpoint-prefixed classes on the cited line, paired with their unprefixed base"
    }
  ],
  "composes": [
    "primitive.placeholder-media",
    "primitive.legacy-theme"
  ],
  "measuredFrom": "src/components/sections/CustomVideo.jsx:9-53",
  "iaSectionId": "story.custom-video",
  "evidenceNotes": [
    "Theme colours are hard-coded (local THEME object, green) rather than taken from legacyVars, so there is no theme prop."
  ],
  "observedOn": [
    "/content/custom-content"
  ],
  "compatibility": {
    "recommendedAfter": [
      "proof.flip-logos"
    ],
    "recommendedBefore": [
      "proof.testimonial-card-legacy"
    ],
    "note": "Derived from every real node sequence in templates/templates.json (incl. per-route sequences)."
  },
  "assetRoles": [
    "asset.userSupplied",
    "illustration.generated",
    "placeholder.neutral",
    "product.video",
    "screenshot.placeholder",
    "stock.photo"
  ]
}
